{
  "schema": "cloudig/identity/1.0.0",
  "front_id": "01993520-0000-7000-8000-000000000001",
  "names": [
    {
      "name": "示例用户",
      "claimers": [
        {
          "front": "01993520-0000-7000-8000-000000000001"
        }
      ]
    }
  ],
  "display_name": 1,
  "kind": {
    "world": "terran",
    "subject": "human"
  },
  "created_at": "2026-09-11T09:00:00Z",
  "edited_at": "2026-09-11T09:00:00Z"
}
